 64032, length 164
23:46:52.375781 IP 134.122.36.42.22 > 205.189.187.4.50205: Flags [P.], seq 1017052:1017216, ack 541, win 64032, length 164
23:46:52.375804 IP 205.189.187.4.50205 > 134.122.36.42.22: Flags [.], ack 986760, win 62992, length 0
23:46:52.375804 IP 205.189.187.4.50205 > 134.122.36.42.22: Flags [.], ack 987384, win 64240, length 0
23:46:52.375900 IP 134.122.36.42.22 > 205.189.187.4.50205: Flags [P.], seq 1017216:1017580, ack 541, win 64032, length 364
23:46:52.375992 IP 134.122.36.42.22 > 205.189.187.4.50205: Flags [P.], seq 1017580:1017744, ack 541, win 64032, length 164
23:46:52.376072 IP 134.122.36.42.22 > 205.189.187.4.50205: Flags [P.], seq 1017744:1017908, ack 541, win 64032, length 164
23:46:52.376184 IP 134.122.36.42.22 > 205.189.187.4.50205: Flags [P.], seq 1017908:1018072, ack 541, win 64032, length 164
23:46:52.376269 IP 134.122.36.42.22 > 205.189.187.4.50205: Flags [P.], seq 1018072:1018236, ack 541, win 64032, length 164
23:46:52.376337 IP 134.122.36.42.22 > 205.189.187.4.50205: Flags [P.], seq 1018236:1018400, ack 541, win 64032, length 164
23:46:52.376418 IP 134.122.36.42.22 > 205.189.187.4.50205: Flags [P.], seq 1018400:1018564, ack 541, win 64032, length 164
23:46:52.376501 IP 134.122.36.42.22 > 205.189.187.4.50205: Flags [P.], seq 1018564:1018728, ack 541, win 64032, length 164
23:46:52.376904 IP 134.122.36.42.22 > 205.189.187.4.50205: Flags [P.], seq 1018728:1018892, ack 541, win 64032, length 164
23:46:52.377052 IP 134.122.36.42.22 > 205.189.187.4.50205: Flags [P.], seq 1018892:1019056, ack 541, win 64032, length 164
23:46:52.377163 IP 134.122.36.42.22 > 205.189.187.4.50205: Flags [P.], seq 1019056:1019220, ack 541, win 64032, length 164
23:46:52.377552 IP 134.122.36.42.22 > 205.189.187.4.50205: Flags [P.], seq 1019220:1019384, ack 541, win 64032, length 164
23:46:52.377655 IP 134.122.36.42.22 > 205.189.187.4.50205: Flags [P.], seq 1019384:1019548, ack 541, win 64032, length 164
23:46:52.377717 IP 134.122.36.42.22 > 205.189.187.4.50205: Flags [P.], seq 1019548:1019712, ack 541, win 64032, length 164
23:46:52.377770 IP 134.122.36.42.22 > 205.189.187.4.50205: Flags [P.], seq 1019712:1019876, ack 541, win 64032, length 164
23:46:52.377821 IP 134.122.36.42.22 > 205.189.187.4.50205: Flags [P.], seq 1019876:1020040, ack 541, win 64032, length 164
23:46:52.377938 IP 134.122.36.42.22 > 205.189.187.4.50205: Flags [P.], seq 1020040:1020204, ack 541, win 64032, length 164
23:46:52.378071 IP 134.122.36.42.22 > 205.189.187.4.50205: Flags [P.], seq 1020204:1020368, ack 541, win 64032, length 164
23:46:52.378229 IP 134.122.36.42.22 > 205.189.187.4.50205: Flags [P.], seq 1020368:1020532, ack 541, win 64032, length 164
23:46:52.378335 IP 134.122.36.42.22 > 205.189.187.4.50205: Flags [P.], seq 1020532:1020696, ack 541, win 64032, length 164
23:46:52.378407 IP 134.122.36.42.22 > 205.189.187.4.50205: Flags [P.], seq 1020696:1020860, ack 541, win 64032, length 164
23:46:52.378470 IP 134.122.36.42.22 > 205.189.187.4.50205: Flags [P.], seq 1020860:1021024, ack 541, win 64032, length 164
23:46:52.378533 IP 134.122.36.42.22 > 205.189.187.4.50205: Flags [P.], seq 1021024:1021188, ack 541, win 64032, length 164
23:46:52.378598 IP 134.122.36.42.22 > 205.189.187.4.50205: Flags [P.], seq 1021188:1021352, ack 541, win 64032, length 164
23:46:52.378661 IP 134.122.36.42.22 > 205.189.187.4.50205: Flags [P.], seq 1021352:1021516, ack 541, win 64032, length 164
23:46:52.378721 IP 134.122.36.42.22 > 205.189.187.4.50205: Flags [P.], seq 1021516:1021680, ack 541, win 64032, length 164
23:46:52.378784 IP 134.122.36.42.22 > 205.189.187.4.50205: Flags [P.], seq 1021680:1021844, ack 541, win 64032, length 164
23:46:52.378853 IP 134.122.36.42.22 > 205.189.187.4.50205: Flags [P.], seq 1021844:1022008, ack 541, win 64032, length 164
23:46:52.378917 IP 134.122.36.42.22 > 205.189.187.4.50205: Flags [P.], seq 1022008:1022172, ack 541, win 64032, length 164
23:46:52.378981 IP 134.122.36.42.22 > 205.189.187.4.50205: Flags [P.], seq 1022172:1022336, ack 541, win 64032, length 164
23:46:52.379052 IP 134.122.36.42.22 > 205.189.187.4.50205: Flags [P.], seq 1022336:1022500, ack 541, win 64032, length 164
23:46:52.379175 IP 134.122.36.42.22 > 205.189.187.4.50205: Flags [P.], seq 1022500:1022664, ack 541, win 64032, length 164
23:46:52.379242 IP 134.122.36.42.22 > 205.189.187.4.50205: Flags [P.], seq 1022664:1022828, ack 541, win 64032, length 164
23:46:52.398311 IP 205.189.187.4.50205 > 134.122.36.42.22: Flags [P.], seq 541:577, ack 987540, win 64084, length 36
23:46:52.398389 IP 134.122.36.42.22 > 205.189.187.4.50205: Flags [P.], seq 1022828:1022992, ack 577, win 64032, length 164
^C
6621 packets captured
6621 packets received by filter
0 packets dropped by kernel